[{"name": "Milagros Bautista Dominguez", "date_of_birth": "03/11/1967", "email": "mila_dubai02@ymail.com", "nationality": "PHILIPPINES", "gender": "Female", "contact": "00971568721560", "submit_date": "16/01/2025", "images": "['extracted_images/page1_img1.jpeg']", "file_name": "784196713537908.pdf", "emirates_id": "784196713537908", "pdf_text": "\n--- Page 1 (OCR) ---\nAogl A saboty! 42g!\nCLBLIN Cpalg A yLeadty Auiod |g\nFEDERAL AUTHORITY FOR IDENTITY,\nCITIZENSHIP, CUSTOMS & PORT SECURITY\n\n\u20acunAul djgol\nPersonal Photo\n\nqigm\nREGISTRATION ID CARD FORM\n\na4lbs Quai djloiu!\n\nAPPLICATION NO. WiLbIl ay\n0102943460842025504513922\n\n800220250116114480459\n\nUnited Arab Emirates\n\nwJbII alb gui\nApplication Tracking\n\nfj 7\nAMOUNT PAID acg\u00e9roll oguyll = VALIDITY 4nutoll = APPLICANT TYPE Wilbll pado aia REQUEST TYPE WubIl cgi = PHONENO. eljrioll cailgll ody \u2018=\n\u201cIgiu a6 = \u201c\neet 354.55 YEARS 2 E ayijlol aygm 3933\n: xpat - aal\nAED pat - aalg Piet ate re 00971568721560\nNAME : Milagros Bautista Dominguez jgaioga Linnigh yugyailo + esull\nNATIONALITY : PHILIPPINES sual ayggoa : Guuiall\nGENDER > FEMALE coll : Uuiall\nFILE NUMBER ca\u00e9loll ody IDENTITY NUMBER auggll ody UNIFIED NO aagoll oayll\n201/201 1/2/85366 784196713537908 68504683\nSUBMITTED ON ayliy ona DATE OF BIRTH ailioll ayyli E-MAIL ,,igpi4ull ayyll\n16/01/2025 11:45 03/11/1967 mila_dubai02@ymail.com\na yy,\n\nINEXT STEP_)]\n\nPay attention to messages sent by\nthe authority, whether through \u00bb\n\ne-mail or text messages or by ICP\n\nmobile application notification\n\nReceiving the card from the\napproved delivery company.\n\n4p yo aalbull piliul\n6a0ieell Jungill\n\n(DE\n\ngly! oft (ill JiLuyl! olrii.ll\n\nsyull JuLs wo claw agll yo\ngl 4yoill Jfluy!l gf ig iS IuIl\nafiall Gubi Jus yo Cajloiyll\nasSall\n\n\u2018oll Jali Jul yo Aalbull una? pit\n+ lal loa no Ha\n\nCard will be delivered via Zajel to:\nDUBAI, Burdubai, JUMEIRA FIRST,\n\n|\n\nSubmitted By (Typing Center ach WiSoAhuilgy aclbil\nAL WASAEL DOCUMENTS dailio Hosa! Jilugll\nCLEARING SERVICES enloloell\n\nPrinted on 6/23/2025 11:38:55 AM ayliy oth\n\\' 5 goal Le\n| vean or communty |\n404 1\ncoll\nTHE EMIRATES\nvies f danioll ayjall CajLoull jubgul Jloiull (Spo UAEICP SMART\nYoo ABU DHABI,UNITED ARAB EMIRATES Call Center [eae | GETITON\n: App Store Google PI\nwww.icp.gov.ae P.O. BOX | 47999 | u.uo 600 522222 PP DB Google Play\n\nImportant Remarks\n\ne Make sure that the data, mobile phone number and method of delivery\nentered in the form are correct\n\n\u00ae Make sure to modify the application upon notification of the same to avoid\ncancellation within 30 days at most from the date of notification\n\n\u00ae Fees for typing office services are only 30 dirhams, and in case a typing\noffice asks for more, contact us\n\n\u00ae Keep the financial receipt of the transaction\n\n\u00ae The identity card will be destroyed in case of failing to collect it within 90\ndays from the date of notification\n\n\u00ae Please bring the original passport and the result of the medical examination\nwhen visiting the service center to complete the procedures\n\n\u00ae The transaction form must be presented to receive the ID card from the\ncourier\n\n@ropcallery\n\naolm ulgbA\n(4 4laaoll Jungill aayg Elaioll cailgll edyg GL! dan yo a4lill @\n\ndjloimll\n\ncilbll clell Gini! Wuaeil) Gb! clayl jlo! aie Gib II Yuaeis jal\njlositll Ayli yo pgs 30 Laloal da0 .,4\n\nJb 549 .b4a aja 30 Ga aclbll wil6o load! aigilall pguyll\nWy Jil ayalal pguyy ul\n\nalolool! jIlo!l Jlouwll blaiaill @\n\nuo pg 90 Jild piliwtll pljill pac Jb .,4 auggll aalby vali] oi: \u00bb\njlo! ayli\n\naoaall jAjo 6ylj aic jbl! Uaaall aasiig vill j\u00e9uull jlga jloal ay se\nlelp tl JloSiml\n\nUungill a4 ph jo auggll daly piliaul aloleoll dloiut jlyl ios w\n\n\u2014_\n\ns\n\nCo6JI Gugaull\nUAE PASS\n\nEXPLORE IT ON\n\nBaagoll Jolsioll ign Gilg:\n\nCUSTOMER VOICE PORTAL Update Appointment\n\n"}]